{
  "id": "inception-labs",
  "name": "Inception Labs",
  "types": [
    "model_provider"
  ],
  "status": "active",
  "description": "Inception Labs, developer of the Mercury diffusion language models.",
  "website": "https://www.inceptionlabs.ai",
  "documentation_url": "https://docs.inceptionlabs.ai",
  "updated_at": "2026-09-27",
  "sources": [
    {
      "type": "official",
      "url": "https://www.inceptionlabs.ai",
      "retrieved_at": "2026-09-27",
      "title": "Inception Labs official site",
      "notes": "Vendor of the models imported from the OpenRouter / Vercel AI Gateway catalogues. Only its role as a model developer is recorded here; it has no API of its own in Model Info."
    }
  ]
}
