{
  "id": "quiverai",
  "name": "Quiver AI",
  "types": [
    "model_provider"
  ],
  "status": "active",
  "description": "Quiver AI's vector design models.",
  "website": "https://quiver.ai",
  "updated_at": "2026-09-27",
  "sources": [
    {
      "type": "official",
      "url": "https://quiver.ai",
      "retrieved_at": "2026-09-27",
      "title": "Quiver AI official site",
      "notes": "Vendor of the models imported from the OpenRouter / Vercel AI Gateway catalogues. Only its role as a model developer is recorded here; it has no API of its own in Model Info."
    }
  ]
}
