{
  "id": "ppio",
  "name": "PPIO",
  "types": [
    "api_provider",
    "platform"
  ],
  "website": "https://ppio.com",
  "documentation_url": "https://ppio.com/docs",
  "status": "active",
  "description": "Distributed cloud provider selling serverless LLM inference (OpenAI-compatible) alongside GPU instances.",
  "api": {
    "base_url": "https://api.ppinfra.com/v3/openai",
    "protocol": "https",
    "api_style": "openai_compatible",
    "authentication": {
      "type": "bearer",
      "header": "Authorization"
    },
    "endpoints": {
      "chat_completions": "/chat/completions",
      "models": "/models",
      "completions": "/completions",
      "embeddings": "/embeddings"
    }
  },
  "api_capabilities": {
    "prompt_caching": true
  },
  "sources": [
    {
      "type": "official",
      "url": "https://ppio.com/docs",
      "retrieved_at": "2026-09-27",
      "title": "PPIO docs",
      "notes": "API root https://api.ppinfra.com/v3/openai and the available OpenAI-compatible routes."
    },
    {
      "type": "official",
      "url": "https://api.ppinfra.com/v3/openai/models",
      "retrieved_at": "2026-09-27",
      "title": "Public model list",
      "notes": "Model list is public (GET /models needs no authentication). input_cache_read prices confirm prompt caching is billed."
    }
  ],
  "updated_at": "2026-09-27"
}
