{
  "id": "black-forest-labs",
  "name": "Black Forest Labs",
  "types": [
    "model_provider"
  ],
  "status": "active",
  "description": "Black Forest Labs, developer of the FLUX image models.",
  "website": "https://bfl.ai",
  "documentation_url": "https://docs.bfl.ai",
  "updated_at": "2026-09-27",
  "sources": [
    {
      "type": "official",
      "url": "https://bfl.ai",
      "retrieved_at": "2026-09-27",
      "title": "Black Forest Labs official site",
      "notes": "Vendor of the models imported from the OpenRouter / Vercel AI Gateway catalogues. Only its role as a model developer is recorded here; it has no API of its own in Model Info."
    }
  ]
}
